{
  "id": "parque-vivienda-publica",
  "tipo": "serie_temporal",
  "unidad": "% del total de viviendas",
  "labels": [
    "1976",
    "1977",
    "1978",
    "1979",
    "1980",
    "1981",
    "1982",
    "1983",
    "1984",
    "1985",
    "1986",
    "1987",
    "1988",
    "1989",
    "1990",
    "1991",
    "1992",
    "1993",
    "1994",
    "1995",
    "1996",
    "1997",
    "1998",
    "1999",
    "2000",
    "2001",
    "2002",
    "2003",
    "2004",
    "2005",
    "2006",
    "2007",
    "2008",
    "2009",
    "2010",
    "2011",
    "2012",
    "2013",
    "2014",
    "2015",
    "2016",
    "2017",
    "2018",
    "2019",
    "2020",
    "2021",
    "2022"
  ],
  "series": {
    "espana": [
      null,
      null,
      null,
      null,
      null,
      null,
      null,
      null,
      null,
      null,
      null,
      null,
      null,
      null,
      null,
      null,
      null,
      null,
      null,
      null,
      null,
      null,
      null,
      null,
      null,
      null,
      null,
      null,
      null,
      null,
      null,
      null,
      null,
      null,
      null,
      null,
      null,
      null,
      null,
      null,
      null,
      null,
      null,
      1.1308203126523195,
      null,
      null,
      null
    ],
    "ue27": [
      null,
      null,
      null,
      null,
      null,
      null,
      null,
      null,
      null,
      null,
      null,
      null,
      null,
      null,
      null,
      null,
      null,
      null,
      null,
      null,
      null,
      null,
      null,
      null,
      null,
      null,
      null,
      null,
      null,
      null,
      null,
      null,
      null,
      null,
      null,
      null,
      null,
      null,
      null,
      null,
      null,
      null,
      null,
      null,
      null,
      null,
      null
    ],
    "ocde": [
      null,
      null,
      null,
      null,
      null,
      null,
      null,
      null,
      null,
      null,
      null,
      null,
      null,
      null,
      null,
      null,
      null,
      null,
      null,
      null,
      null,
      null,
      null,
      null,
      null,
      null,
      null,
      null,
      null,
      null,
      null,
      null,
      null,
      null,
      null,
      null,
      null,
      null,
      null,
      null,
      null,
      null,
      null,
      null,
      null,
      null,
      null
    ],
    "eeuu": [
      null,
      null,
      null,
      null,
      null,
      null,
      null,
      null,
      null,
      null,
      null,
      null,
      null,
      null,
      null,
      null,
      null,
      null,
      null,
      null,
      null,
      null,
      null,
      null,
      null,
      null,
      null,
      null,
      null,
      null,
      null,
      null,
      null,
      null,
      3.3668212160570277,
      null,
      null,
      null,
      null,
      null,
      null,
      null,
      null,
      3.620900014556041,
      null,
      null,
      null
    ],
    "canada": [
      null,
      null,
      null,
      null,
      null,
      null,
      null,
      null,
      null,
      null,
      null,
      null,
      null,
      null,
      null,
      null,
      null,
      null,
      null,
      null,
      null,
      null,
      null,
      null,
      null,
      null,
      null,
      null,
      null,
      null,
      null,
      null,
      null,
      null,
      null,
      null,
      null,
      null,
      null,
      null,
      null,
      null,
      null,
      null,
      null,
      null,
      3.472192583808819
    ]
  },
  "fuentes": [
    {
      "serie": "espana",
      "organismo": "OECD",
      "dataset_codigo": "Affordable Housing Database, PH4-2-Social-rental-housing-stock (Table PH4.2.A1: % of total housing stock)",
      "url": "https://webfs.oecd.org/els-com/Affordable_Housing_Database/PH4-2-Social-rental-housing-stock.xlsx",
      "fecha_consulta": "2026-10-10"
    },
    {
      "serie": "ue27",
      "organismo": "OECD",
      "dataset_codigo": "Affordable Housing Database, PH4-2-Social-rental-housing-stock (consultada: sin dato con año)",
      "url": "https://webfs.oecd.org/els-com/Affordable_Housing_Database/PH4-2-Social-rental-housing-stock.xlsx",
      "fecha_consulta": "2026-10-10"
    },
    {
      "serie": "ocde",
      "organismo": "OECD",
      "dataset_codigo": "Affordable Housing Database, PH4-2-Social-rental-housing-stock (consultada: sin dato con año)",
      "url": "https://webfs.oecd.org/els-com/Affordable_Housing_Database/PH4-2-Social-rental-housing-stock.xlsx",
      "fecha_consulta": "2026-10-10"
    },
    {
      "serie": "eeuu",
      "organismo": "OECD",
      "dataset_codigo": "Affordable Housing Database, PH4-2-Social-rental-housing-stock (Table PH4.2.A1: % of total housing stock)",
      "url": "https://webfs.oecd.org/els-com/Affordable_Housing_Database/PH4-2-Social-rental-housing-stock.xlsx",
      "fecha_consulta": "2026-10-10"
    },
    {
      "serie": "canada",
      "organismo": "OECD",
      "dataset_codigo": "Affordable Housing Database, PH4-2-Social-rental-housing-stock (Table PH4.2.A1: % of total housing stock)",
      "url": "https://webfs.oecd.org/els-com/Affordable_Housing_Database/PH4-2-Social-rental-housing-stock.xlsx",
      "fecha_consulta": "2026-10-10"
    }
  ],
  "notas": [
    "OECD Affordable Housing Database (PH4.2): viviendas sociales en alquiler en porcentaje del total de viviendas. La OCDE publica uno o dos datos por país, hacia 2010 y hacia 2022, cada uno con su año.",
    "Cada país define la vivienda social a su manera; la OCDE armoniza la definición: alquiler por debajo del precio de mercado, adjudicado con criterios administrativos.",
    "UE-27 y OCDE: la base no publica un dato para la UE-27, y la media de la OCDE solo aparece en una figura sin año exacto; esas series quedan sin dato.",
    "España: primer dato disponible en 2019.",
    "Media UE-27 y Media OCDE: sin datos en la ventana 1976-2022.",
    "Estados Unidos: primer dato disponible en 2010.",
    "Canadá: primer dato disponible en 2022."
  ],
  "generado_por": "temas/vivienda/notebooks/parque-vivienda-publica.ipynb",
  "generado_en": "2026-10-10T14:16:07Z"
}
