{
  "id": "cuna-fiscal-trabajo",
  "tipo": "serie_temporal",
  "unidad": "% del coste laboral",
  "labels": [
    "1976",
    "1977",
    "1978",
    "1979",
    "1980",
    "1981",
    "1982",
    "1983",
    "1984",
    "1985",
    "1986",
    "1987",
    "1988",
    "1989",
    "1990",
    "1991",
    "1992",
    "1993",
    "1994",
    "1995",
    "1996",
    "1997",
    "1998",
    "1999",
    "2000",
    "2001",
    "2002",
    "2003",
    "2004",
    "2005",
    "2006",
    "2007",
    "2008",
    "2009",
    "2010",
    "2011",
    "2012",
    "2013",
    "2014",
    "2015",
    "2016",
    "2017",
    "2018",
    "2019",
    "2020",
    "2021",
    "2022",
    "2023",
    "2024",
    "2025"
  ],
  "series": {
    "espana": [
      null,
      null,
      null,
      null,
      null,
      null,
      null,
      null,
      null,
      null,
      null,
      null,
      null,
      null,
      null,
      null,
      null,
      null,
      null,
      null,
      null,
      null,
      null,
      null,
      38.627724,
      38.858001,
      39.101446,
      38.58189,
      38.809975,
      38.968565,
      39.112234,
      38.987028,
      37.991003,
      38.257526,
      39.746546,
      39.985142,
      40.615097,
      40.660487,
      40.716086,
      39.389283,
      39.379123,
      39.57737,
      39.678687,
      39.789289,
      39.333727,
      39.867712,
      40.046618,
      40.754816,
      41.136398,
      41.444078
    ],
    "ue27": [
      null,
      null,
      null,
      null,
      null,
      null,
      null,
      null,
      null,
      null,
      null,
      null,
      null,
      null,
      null,
      null,
      null,
      null,
      null,
      null,
      null,
      null,
      null,
      null,
      null,
      null,
      null,
      null,
      null,
      null,
      null,
      null,
      null,
      null,
      null,
      null,
      null,
      null,
      null,
      null,
      null,
      null,
      null,
      null,
      null,
      null,
      null,
      null,
      null,
      null
    ],
    "ocde": [
      null,
      null,
      null,
      null,
      null,
      null,
      null,
      null,
      null,
      null,
      null,
      null,
      null,
      null,
      null,
      null,
      null,
      null,
      null,
      null,
      null,
      null,
      null,
      null,
      36.149592,
      35.856956,
      35.703821,
      35.550723,
      35.629506,
      35.4416,
      35.386586,
      35.353513,
      34.888159,
      34.398673,
      34.454524,
      34.904403,
      35.029881,
      35.143834,
      35.157872,
      35.177868,
      35.116751,
      34.998419,
      34.854507,
      34.788409,
      34.582564,
      34.521159,
      34.655762,
      34.815343,
      34.929104,
      35.08354
    ],
    "eeuu": [
      null,
      null,
      null,
      null,
      null,
      null,
      null,
      null,
      null,
      null,
      null,
      null,
      null,
      null,
      null,
      null,
      null,
      null,
      null,
      null,
      null,
      null,
      null,
      null,
      30.843152,
      30.739565,
      30.584252,
      30.460411,
      30.482758,
      30.418159,
      30.552005,
      30.917168,
      30.061773,
      30.278889,
      30.747766,
      29.905917,
      29.842844,
      31.450768,
      31.641234,
      31.437078,
      31.580608,
      31.775433,
      29.598968,
      29.655894,
      27.211586,
      28.269089,
      30.461555,
      30.014632,
      30.069366,
      29.977066
    ],
    "canada": [
      null,
      null,
      null,
      null,
      null,
      null,
      null,
      null,
      null,
      null,
      null,
      null,
      null,
      null,
      null,
      null,
      null,
      null,
      null,
      null,
      null,
      null,
      null,
      null,
      34.070489,
      32.610508,
      32.709518,
      32.532516,
      32.686019,
      32.805032,
      32.811685,
      32.392128,
      32.381336,
      32.124166,
      31.84715,
      32.014081,
      32.107431,
      32.274446,
      32.446444,
      32.490034,
      32.114861,
      31.398703,
      31.364272,
      30.999762,
      31.090484,
      31.482013,
      31.863035,
      31.85745,
      31.988901,
      32.122868
    ]
  },
  "fuentes": [
    {
      "serie": "espana",
      "organismo": "OECD",
      "dataset_codigo": "OECD.CTP.TPS,DSD_TAX_WAGES_COMP@DF_TW_COMP,2.1 (AV_TW, PT_COS_LB, S_C0, AW100)",
      "url": "https://data-explorer.oecd.org/",
      "fecha_consulta": "2026-10-11"
    },
    {
      "serie": "ue27",
      "organismo": "Eurostat",
      "dataset_codigo": "earn_nt_taxwedge (solo el caso del 67 % del salario medio) y earn_nt_net (sin cotizaciones de la empresa), consultados",
      "url": "https://ec.europa.eu/eurostat/databrowser/view/earn_nt_taxwedge/default/table?lang=en",
      "fecha_consulta": "2026-10-11"
    },
    {
      "serie": "ocde",
      "organismo": "OECD",
      "dataset_codigo": "OECD.CTP.TPS,DSD_TAX_WAGES_COMP@DF_TW_COMP,2.1 (AV_TW, PT_COS_LB, S_C0, AW100, área OECD_REP)",
      "url": "https://data-explorer.oecd.org/",
      "fecha_consulta": "2026-10-11"
    },
    {
      "serie": "eeuu",
      "organismo": "OECD",
      "dataset_codigo": "OECD.CTP.TPS,DSD_TAX_WAGES_COMP@DF_TW_COMP,2.1 (AV_TW, PT_COS_LB, S_C0, AW100)",
      "url": "https://data-explorer.oecd.org/",
      "fecha_consulta": "2026-10-11"
    },
    {
      "serie": "canada",
      "organismo": "OECD",
      "dataset_codigo": "OECD.CTP.TPS,DSD_TAX_WAGES_COMP@DF_TW_COMP,2.1 (AV_TW, PT_COS_LB, S_C0, AW100)",
      "url": "https://data-explorer.oecd.org/",
      "fecha_consulta": "2026-10-11"
    }
  ],
  "notas": [
    "Cuña fiscal media de la OCDE (Taxing Wages, DSD_TAX_WAGES_COMP@DF_TW_COMP, medida AV_TW) de un soltero sin hijos con el 100 % del salario medio: impuesto sobre la renta y cotizaciones sociales del trabajador y de la empresa, menos prestaciones monetarias, en porcentaje del coste laboral total (salario bruto más cotizaciones de la empresa).",
    "Es un caso tipo calculado con las normas de cada año, no lo que pagan de media los asalariados: solo tiene en cuenta las deducciones de aplicación general, no las ligadas a gastos o circunstancias personales.",
    "Media OCDE: media simple, sin ponderar, de los 38 países que hoy son miembros de la OCDE, en todos los años, también los anteriores a su ingreso (área OECD_REP).",
    "Media UE-27 sin dato: Eurostat solo publica la cuña fiscal (earn_nt_taxwedge) de un soltero sin hijos con el 67 % del salario medio, un caso distinto del de esta gráfica, y para el caso del 100 % (earn_nt_net) no publica las cotizaciones de la empresa, necesarias para calcularla.",
    "No se usa como sustituto la media que la OCDE publica para los países de la UE que son miembros de la OCDE (EU22OECD), porque no cubre toda la UE-27.",
    "España: Eurostat sí publica la cuña del soltero sin hijos con el 67 % del salario medio (earn_nt_taxwedge): coincide con la de la OCDE para ese caso en 2000-2016, salvo el redondeo (menos de 0,1 puntos), y en 2017-2025 es más baja, con una diferencia de hasta 0,76 puntos (2025).",
    "Los años anteriores al primer dato quedan sin dato porque la OCDE no los publica en su Data Explorer.",
    "EE. UU.: la cuña de 2008, 2020 y 2021 es más baja porque descuenta prestaciones monetarias que el trabajador tipo solo recibió esos años.",
    "España, Media OCDE, Estados Unidos y Canadá: primer dato disponible en 2000.",
    "Media UE-27: sin datos en la ventana 1976-2025."
  ],
  "generado_por": "temas/fiscalidad/notebooks/cuna-fiscal-trabajo.ipynb",
  "generado_en": "2026-10-11T17:02:24Z"
}
