{
  "id": "impuestos-patrimonio-sucesiones",
  "tipo": "serie_temporal",
  "unidad": "% del PIB",
  "labels": [
    "1976",
    "1977",
    "1978",
    "1979",
    "1980",
    "1981",
    "1982",
    "1983",
    "1984",
    "1985",
    "1986",
    "1987",
    "1988",
    "1989",
    "1990",
    "1991",
    "1992",
    "1993",
    "1994",
    "1995",
    "1996",
    "1997",
    "1998",
    "1999",
    "2000",
    "2001",
    "2002",
    "2003",
    "2004",
    "2005",
    "2006",
    "2007",
    "2008",
    "2009",
    "2010",
    "2011",
    "2012",
    "2013",
    "2014",
    "2015",
    "2016",
    "2017",
    "2018",
    "2019",
    "2020",
    "2021",
    "2022",
    "2023",
    "2024"
  ],
  "series": {
    "espana": [
      0.116876,
      0.114201,
      0.179528,
      0.206685,
      0.196084,
      0.178518,
      0.190933,
      0.191654,
      0.190197,
      0.194421,
      0.208901,
      0.277632,
      0.284083,
      0.194755,
      0.327933,
      0.263873,
      0.263586,
      0.280477,
      0.331916,
      0.351324,
      0.358118,
      0.384222,
      0.387178,
      0.401182,
      0.431151,
      0.400452,
      0.389866,
      0.395424,
      0.405786,
      0.445308,
      0.463195,
      0.499285,
      0.52138,
      0.306153,
      0.287798,
      0.269676,
      0.360534,
      0.442742,
      0.43929,
      0.431786,
      0.418,
      0.41059,
      0.404694,
      0.379115,
      0.424809,
      0.478035,
      0.454696,
      0.435116,
      0.421556
    ],
    "ue27": [
      null,
      null,
      null,
      null,
      null,
      null,
      null,
      null,
      null,
      null,
      null,
      null,
      null,
      null,
      null,
      null,
      null,
      null,
      null,
      null,
      null,
      null,
      null,
      null,
      null,
      null,
      null,
      null,
      null,
      null,
      null,
      null,
      null,
      null,
      null,
      null,
      null,
      null,
      null,
      null,
      null,
      null,
      null,
      null,
      null,
      null,
      null,
      null,
      null
    ],
    "ocde": [
      0.373783,
      0.366609,
      0.350286,
      0.335442,
      0.315534,
      0.324356,
      0.318019,
      0.350644,
      0.32543,
      0.326613,
      0.341398,
      0.352205,
      0.364303,
      0.369055,
      0.347059,
      0.318402,
      0.328825,
      0.32818,
      0.322912,
      0.280002,
      0.2893,
      0.286393,
      0.285715,
      0.3022,
      0.307013,
      0.289448,
      0.285405,
      0.262521,
      0.26065,
      0.266387,
      0.256307,
      0.258401,
      0.249901,
      0.24729,
      0.25258,
      0.274168,
      0.279831,
      0.288591,
      0.288214,
      0.287368,
      0.282171,
      0.292417,
      0.276536,
      0.286304,
      0.301537,
      0.308825,
      0.29928,
      0.306136,
      null
    ],
    "eeuu": [
      0.359184,
      0.438653,
      0.30307,
      0.281045,
      0.294858,
      0.281131,
      0.30926,
      0.236596,
      0.203982,
      0.20166,
      0.207266,
      0.217436,
      0.207565,
      0.217244,
      0.264206,
      0.253275,
      0.242242,
      0.257153,
      0.277581,
      0.262299,
      0.286259,
      0.314472,
      0.357427,
      0.381106,
      0.347675,
      0.337339,
      0.29878,
      0.247415,
      0.248461,
      0.233335,
      0.239425,
      0.220578,
      0.228133,
      0.174098,
      0.130899,
      0.094367,
      0.118359,
      0.155083,
      0.135157,
      0.139646,
      0.134418,
      0.144388,
      0.136087,
      0.099572,
      0.118457,
      0.145026,
      0.157294,
      0.154168,
      0.130209
    ],
    "canada": [
      0.204223,
      0.173624,
      0.190015,
      0.178104,
      0.176211,
      0.206685,
      0.245579,
      0.22433,
      0.247261,
      0.232204,
      0.266704,
      0.234889,
      0.250014,
      0.280372,
      0.274822,
      0.257055,
      0.312829,
      0.321852,
      0.329843,
      0.348413,
      0.370152,
      0.385228,
      0.386891,
      0.371525,
      0.370776,
      0.318555,
      0.276955,
      0.239172,
      0.246607,
      0.243108,
      0.223105,
      0.188253,
      0.139345,
      0.136254,
      0.102098,
      0.064823,
      0.04537,
      0.033382,
      0.029426,
      0.032153,
      0.033176,
      0.034615,
      0.035158,
      0.034665,
      0.036163,
      0.037227,
      0.037497,
      0.03705,
      0.035706
    ]
  },
  "fuentes": [
    {
      "serie": "espana",
      "organismo": "OECD",
      "dataset_codigo": "DSD_REV_COMP_OECD@DF_RSOECD (Revenue Statistics, versión 2.0): TAX_REV, S13, T_4200 + T_4300, PT_B1GQ",
      "url": "https://data-explorer.oecd.org/",
      "fecha_consulta": "2026-10-11"
    },
    {
      "serie": "ue27",
      "organismo": "Eurostat",
      "dataset_codigo": "gov_10a_taxag (consultado: D59A + D91A no es comparable con las categorías 4200 + 4300 de la OCDE)",
      "url": "https://ec.europa.eu/eurostat/databrowser/view/gov_10a_taxag/default/table?lang=en",
      "fecha_consulta": "2026-10-11"
    },
    {
      "serie": "ocde",
      "organismo": "OECD",
      "dataset_codigo": "DSD_REV_COMP_OECD@DF_RSOECD (Revenue Statistics, versión 2.0): TAX_REV, S13, T_4200 + T_4300, PT_B1GQ; área OECD_REP",
      "url": "https://data-explorer.oecd.org/",
      "fecha_consulta": "2026-10-11"
    },
    {
      "serie": "eeuu",
      "organismo": "OECD",
      "dataset_codigo": "DSD_REV_COMP_OECD@DF_RSOECD (Revenue Statistics, versión 2.0): TAX_REV, S13, T_4200 + T_4300, PT_B1GQ",
      "url": "https://data-explorer.oecd.org/",
      "fecha_consulta": "2026-10-11"
    },
    {
      "serie": "canada",
      "organismo": "OECD",
      "dataset_codigo": "DSD_REV_COMP_OECD@DF_RSOECD (Revenue Statistics, versión 2.0): TAX_REV, S13, T_4200 + T_4300, PT_B1GQ",
      "url": "https://data-explorer.oecd.org/",
      "fecha_consulta": "2026-10-11"
    }
  ],
  "notas": [
    "España, media OCDE, EE. UU. y Canadá: OCDE, Revenue Statistics (DSD_REV_COMP_OECD@DF_RSOECD, versión 2.0): suma de las categorías 4200 (impuestos periódicos sobre el patrimonio neto, de personas y sociedades) y 4300 (impuestos sobre sucesiones, herencias y donaciones), recaudados por el conjunto de las administraciones públicas, en porcentaje del PIB.",
    "No incluye el IBI (categoría 4100) ni el Impuesto sobre Transmisiones Patrimoniales y Actos Jurídicos Documentados (categoría 4400), que gravan la propiedad inmobiliaria y las transacciones.",
    "Media OCDE: media simple, sin ponderar, de los países que hoy son miembros de la OCDE con dato en cada año (área OECD_REP): 24 países en 1976 y los 38 desde 1995.",
    "La OCDE no publica todavía la media de 2024: faltan los datos de 2 de sus 38 países miembros (Australia y Grecia).",
    "Media UE-27 sin dato: en las cuentas nacionales que publica Eurostat (gov_10a_taxag), los impuestos corrientes sobre el capital (D59A) incluyen en varios países impuestos periódicos sobre la vivienda que pagan los hogares, que la OCDE clasifica como impuestos sobre bienes inmuebles (4100); en 2024, D59A equivale al 0,23 % del PIB en Francia y al 0,48 % en Dinamarca, frente al 0,09 % y el 0 % de la categoría 4200 de la OCDE, así que D59A + D91A no es comparable con esta gráfica.",
    "En España las dos fuentes coinciden: entre 1995 y 2024, D59A + D91A de Eurostat y 4200 + 4300 de la OCDE difieren como máximo en 0,002 puntos del PIB.",
    "España: la OCDE publica 0 en la categoría 4200 hasta 1977, porque el primer impuesto periódico sobre el patrimonio, el Impuesto Extraordinario sobre el Patrimonio de las Personas Físicas, se creó a finales de 1977 (Ley 50/1977); en esos años la serie solo recoge sucesiones y donaciones.",
    "España: la recaudación baja en 2009-2011 porque el Impuesto sobre el Patrimonio tuvo una bonificación general del 100 % para los ejercicios 2008 a 2010 (Ley 4/2008) hasta su restablecimiento temporal en 2011 (Real Decreto-ley 13/2011), y se paga el año siguiente al devengo; no llega a cero porque la categoría 4200 incluye otros ingresos, que en 2009 fueron el 86 % de ella.",
    "España: desde 2023 la categoría 4200 incluye también el Impuesto Temporal de Solidaridad de las Grandes Fortunas (Ley 38/2022), cuya primera recaudación, la del ejercicio 2022, se cobró en 2023.",
    "España: según el desglose nacional de la OCDE (DSD_REV_OECD@DF_REVESP), en 2024 la categoría 4200 se reparte entre el Impuesto sobre el Patrimonio (72 %), el de Grandes Fortunas (1 %) y un concepto que la OCDE denomina «impuesto sobre inmuebles desocupados y otros» (27 %), recaudado en un 98 % por las entidades locales.",
    "EE. UU. no tiene impuesto periódico sobre el patrimonio neto (la OCDE publica 0 en la categoría 4200): su serie es solo la recaudación por sucesiones y donaciones.",
    "Canadá no grava el patrimonio neto de las personas físicas: toda su categoría 4200 son impuestos sobre el capital de las sociedades (subcategoría 4220), cuya recaudación cae desde comienzos de los años 2000 hasta casi desaparecer.",
    "España, Media OCDE, Estados Unidos y Canadá: primer dato disponible en 1976.",
    "Media UE-27: sin datos en la ventana 1976-2024."
  ],
  "generado_por": "temas/fiscalidad/notebooks/impuestos-patrimonio-sucesiones.ipynb",
  "generado_en": "2026-10-11T16:54:04Z"
}
