{
  "id": "productividad-hora",
  "tipo": "serie_temporal",
  "unidad": "Dólares PPA por hora, a precios constantes de 2020",
  "labels": [
    "1976",
    "1977",
    "1978",
    "1979",
    "1980",
    "1981",
    "1982",
    "1983",
    "1984",
    "1985",
    "1986",
    "1987",
    "1988",
    "1989",
    "1990",
    "1991",
    "1992",
    "1993",
    "1994",
    "1995",
    "1996",
    "1997",
    "1998",
    "1999",
    "2000",
    "2001",
    "2002",
    "2003",
    "2004",
    "2005",
    "2006",
    "2007",
    "2008",
    "2009",
    "2010",
    "2011",
    "2012",
    "2013",
    "2014",
    "2015",
    "2016",
    "2017",
    "2018",
    "2019",
    "2020",
    "2021",
    "2022",
    "2023",
    "2024",
    "2025"
  ],
  "series": {
    "espana": [
      null,
      null,
      null,
      null,
      null,
      null,
      null,
      null,
      null,
      null,
      null,
      null,
      null,
      null,
      null,
      null,
      null,
      null,
      null,
      52.35793454845838,
      52.8203334374301,
      52.65899453250993,
      52.34273099845522,
      52.09415057910988,
      52.29880731929661,
      52.309684547232294,
      52.41109782642332,
      52.564430201576315,
      52.73453513121698,
      52.898381800733574,
      53.19045856774033,
      53.72197481533554,
      53.77092922242792,
      55.032227327474,
      56.36276948329654,
      57.2137139027773,
      58.38577333663197,
      59.233739378836,
      59.515761647513344,
      60.13074449884353,
      60.34292224395987,
      60.78892934578575,
      60.745617435203904,
      60.88583350061363,
      60.913382225942385,
      60.60224613800636,
      61.35507925732302,
      61.2280745349131,
      61.960142203687006,
      62.419959518240894
    ],
    "ue27": [
      null,
      null,
      null,
      null,
      null,
      null,
      null,
      null,
      null,
      null,
      null,
      null,
      null,
      null,
      null,
      null,
      null,
      null,
      null,
      45.66716917138001,
      46.27946437312905,
      47.20312609181764,
      48.020213708785725,
      49.04389889885491,
      50.63697032081076,
      51.65388777200681,
      52.67129933765791,
      53.19897841044136,
      54.06142675526086,
      54.71779358847077,
      55.65832152239919,
      56.16549743020946,
      56.01219840406792,
      55.386182329745424,
      56.96998120233009,
      58.047661484852405,
      58.31582427139602,
      58.833995933366275,
      59.25880159818218,
      60.1086527170469,
      60.31564654359066,
      61.37191500157618,
      61.821871098888664,
      62.31118994205577,
      63.15676769502922,
      63.52917955251514,
      63.777056891249366,
      63.26995683528296,
      63.459277850287926,
      64.32936034568354
    ],
    "ocde": [
      null,
      null,
      null,
      null,
      null,
      null,
      null,
      null,
      null,
      null,
      null,
      null,
      null,
      null,
      null,
      null,
      null,
      null,
      null,
      null,
      42.33372737069463,
      43.40677499157816,
      44.20503434272113,
      45.17892309711087,
      46.66196763487223,
      47.51081517143516,
      48.56740671184813,
      49.63889400658895,
      50.80823506777469,
      51.83154808612813,
      52.64358694743582,
      53.406669586721776,
      53.69171678688855,
      53.75456249189278,
      55.1525762140468,
      55.809161105906966,
      56.179711466250225,
      56.8530689433492,
      57.41876797671578,
      58.26881301614544,
      58.6556326493882,
      59.696582316396984,
      60.39216714136007,
      61.186764620553795,
      63.30986379860523,
      63.75598466371113,
      63.959768020521174,
      64.34825918188605,
      65.09031502844839,
      66.26919798219387
    ],
    "eeuu": [
      null,
      null,
      null,
      null,
      null,
      null,
      null,
      null,
      null,
      null,
      null,
      45.86850117378371,
      46.37789682536013,
      47.03499090479843,
      47.6326681993033,
      48.18909113093932,
      49.777993682571235,
      49.91039150894257,
      50.48436518072699,
      50.79988916452268,
      51.79577985976664,
      52.630838665525395,
      53.9002361259296,
      55.40549376691621,
      56.8504114124619,
      58.21914399133466,
      59.99792776000466,
      61.996445115484114,
      63.54378822840639,
      64.82301170051905,
      65.49329217820618,
      66.14358889328253,
      67.05696681449068,
      69.50046570394345,
      71.1906111351642,
      71.11001979434774,
      71.46617232541249,
      71.79887931400513,
      72.35346735812777,
      73.19851169166591,
      73.6846854784062,
      74.46483796197043,
      75.27728632091625,
      76.57222195017918,
      80.05585297032337,
      81.52020497270419,
      81.10142875669932,
      82.26885599486027,
      84.1147144673672,
      85.60236428340167
    ],
    "canada": [
      37.202052537914966,
      38.27010123510696,
      38.571621853887365,
      38.19713515177297,
      38.09275874779017,
      38.59420572357562,
      39.13534887118872,
      40.02996618829016,
      41.11407434509473,
      41.483167073295846,
      41.11953818285769,
      41.309237380518915,
      41.705460704560934,
      41.81386175207341,
      41.78297736483981,
      42.14820227909761,
      43.0062561327768,
      43.87505056955551,
      44.74710108702527,
      45.28829542807416,
      45.21973816752852,
      45.93846117402578,
      46.80320138495287,
      47.99376326151331,
      49.510398695459195,
      50.348078284042145,
      51.150439100106496,
      51.26179427554021,
      51.691375488199995,
      52.83869517980182,
      53.505930356458066,
      53.520845636810456,
      53.39753603602733,
      53.57917421055228,
      53.8968445832354,
      54.82913231360357,
      54.77939212266667,
      55.53417078998078,
      57.1141075896649,
      56.94255550680974,
      57.255592360228526,
      58.06399917193337,
      58.22288307933497,
      58.407190939575585,
      62.913761403731215,
      60.37637632003892,
      60.24501126337926,
      59.39503330392318,
      59.39593841854104,
      59.98032104946156
    ]
  },
  "fuentes": [
    {
      "serie": "espana",
      "organismo": "OECD",
      "dataset_codigo": "DSD_PDB@DF_PDB",
      "url": "https://data-explorer.oecd.org/",
      "fecha_consulta": "2026-10-15"
    },
    {
      "serie": "ue27",
      "organismo": "OECD",
      "dataset_codigo": "DSD_PDB@DF_PDB",
      "url": "https://data-explorer.oecd.org/",
      "fecha_consulta": "2026-10-15"
    },
    {
      "serie": "ocde",
      "organismo": "OECD",
      "dataset_codigo": "DSD_PDB@DF_PDB",
      "url": "https://data-explorer.oecd.org/",
      "fecha_consulta": "2026-10-15"
    },
    {
      "serie": "eeuu",
      "organismo": "OECD",
      "dataset_codigo": "DSD_PDB@DF_PDB",
      "url": "https://data-explorer.oecd.org/",
      "fecha_consulta": "2026-10-15"
    },
    {
      "serie": "canada",
      "organismo": "OECD",
      "dataset_codigo": "DSD_PDB@DF_PDB",
      "url": "https://data-explorer.oecd.org/",
      "fecha_consulta": "2026-10-15"
    }
  ],
  "notas": [
    "OCDE, base de datos de productividad (DSD_PDB@DF_PDB, versión 2.0): PIB por hora trabajada (GDPHRS), total de actividades, en dólares estadounidenses PPA, en volúmenes encadenados con 2020 como año de referencia.",
    "UE-27: agregado de composición actual (EU27_2020) publicado por la OCDE. OCDE: agregado publicado por la OCDE.",
    "Las horas trabajadas se estiman con encuestas y fuentes administrativas que difieren entre países.",
    "España y Media UE-27: primer dato disponible en 1995.",
    "Media OCDE: primer dato disponible en 1996.",
    "Estados Unidos: primer dato disponible en 1987.",
    "Canadá: primer dato disponible en 1976."
  ],
  "generado_por": "temas/empleo/notebooks/productividad-hora.ipynb",
  "generado_en": "2026-10-15T13:44:21Z"
}
