{
  "id": "carencia-material-ocupados",
  "tipo": "serie_temporal",
  "unidad": "% de las personas ocupadas de 18 años o más",
  "labels": [
    "1976",
    "1977",
    "1978",
    "1979",
    "1980",
    "1981",
    "1982",
    "1983",
    "1984",
    "1985",
    "1986",
    "1987",
    "1988",
    "1989",
    "1990",
    "1991",
    "1992",
    "1993",
    "1994",
    "1995",
    "1996",
    "1997",
    "1998",
    "1999",
    "2000",
    "2001",
    "2002",
    "2003",
    "2004",
    "2005",
    "2006",
    "2007",
    "2008",
    "2009",
    "2010",
    "2011",
    "2012",
    "2013",
    "2014",
    "2015",
    "2016",
    "2017",
    "2018",
    "2019",
    "2020",
    "2021",
    "2022",
    "2023",
    "2024",
    "2025"
  ],
  "series": {
    "espana": [
      null,
      null,
      null,
      null,
      null,
      null,
      null,
      null,
      null,
      null,
      null,
      null,
      null,
      null,
      null,
      null,
      null,
      null,
      null,
      null,
      null,
      null,
      null,
      null,
      null,
      null,
      null,
      null,
      null,
      null,
      null,
      null,
      null,
      null,
      null,
      null,
      null,
      null,
      null,
      3.3,
      4.1,
      3.9,
      3.7,
      3.4,
      5.3,
      4.5,
      4.9,
      6.5,
      6.1,
      6.4
    ],
    "ue27": [
      null,
      null,
      null,
      null,
      null,
      null,
      null,
      null,
      null,
      null,
      null,
      null,
      null,
      null,
      null,
      null,
      null,
      null,
      null,
      null,
      null,
      null,
      null,
      null,
      null,
      null,
      null,
      null,
      null,
      null,
      null,
      null,
      null,
      null,
      null,
      null,
      null,
      null,
      null,
      5.5,
      5.0,
      4.3,
      3.8,
      3.5,
      3.7,
      3.3,
      3.8,
      4.1,
      3.8,
      3.7
    ],
    "ocde": [
      null,
      null,
      null,
      null,
      null,
      null,
      null,
      null,
      null,
      null,
      null,
      null,
      null,
      null,
      null,
      null,
      null,
      null,
      null,
      null,
      null,
      null,
      null,
      null,
      null,
      null,
      null,
      null,
      null,
      null,
      null,
      null,
      null,
      null,
      null,
      null,
      null,
      null,
      null,
      null,
      null,
      null,
      null,
      null,
      null,
      null,
      null,
      null,
      null,
      null
    ],
    "eeuu": [
      null,
      null,
      null,
      null,
      null,
      null,
      null,
      null,
      null,
      null,
      null,
      null,
      null,
      null,
      null,
      null,
      null,
      null,
      null,
      null,
      null,
      null,
      null,
      null,
      null,
      null,
      null,
      null,
      null,
      null,
      null,
      null,
      null,
      null,
      null,
      null,
      null,
      null,
      null,
      null,
      null,
      null,
      null,
      null,
      null,
      null,
      null,
      null,
      null,
      null
    ],
    "canada": [
      null,
      null,
      null,
      null,
      null,
      null,
      null,
      null,
      null,
      null,
      null,
      null,
      null,
      null,
      null,
      null,
      null,
      null,
      null,
      null,
      null,
      null,
      null,
      null,
      null,
      null,
      null,
      null,
      null,
      null,
      null,
      null,
      null,
      null,
      null,
      null,
      null,
      null,
      null,
      null,
      null,
      null,
      null,
      null,
      null,
      null,
      null,
      null,
      null,
      null
    ]
  },
  "fuentes": [
    {
      "serie": "espana",
      "organismo": "Eurostat",
      "dataset_codigo": "ilc_mdsd12 (wstatus=EMP, age=Y_GE18, sex=T, unit=PC)",
      "url": "https://ec.europa.eu/eurostat/databrowser/view/ilc_mdsd12/default/table?lang=en",
      "fecha_consulta": "2026-10-22"
    },
    {
      "serie": "ue27",
      "organismo": "Eurostat",
      "dataset_codigo": "ilc_mdsd12 (wstatus=EMP, age=Y_GE18, sex=T, unit=PC)",
      "url": "https://ec.europa.eu/eurostat/databrowser/view/ilc_mdsd12/default/table?lang=en",
      "fecha_consulta": "2026-10-22"
    },
    {
      "serie": "ocde",
      "organismo": "Eurostat",
      "dataset_codigo": "ilc_mdsd12: sin media de la OCDE: el indicador solo existe en la encuesta europea EU-SILC",
      "url": "https://ec.europa.eu/eurostat/databrowser/view/ilc_mdsd12/default/table?lang=en",
      "fecha_consulta": "2026-10-22"
    },
    {
      "serie": "eeuu",
      "organismo": "Eurostat",
      "dataset_codigo": "ilc_mdsd12: sin dato: el indicador solo existe en la encuesta europea EU-SILC",
      "url": "https://ec.europa.eu/eurostat/databrowser/view/ilc_mdsd12/default/table?lang=en",
      "fecha_consulta": "2026-10-22"
    },
    {
      "serie": "canada",
      "organismo": "Eurostat",
      "dataset_codigo": "ilc_mdsd12: sin dato: el indicador solo existe en la encuesta europea EU-SILC",
      "url": "https://ec.europa.eu/eurostat/databrowser/view/ilc_mdsd12/default/table?lang=en",
      "fecha_consulta": "2026-10-22"
    }
  ],
  "notas": [
    "España y UE-27: Eurostat, EU-SILC, tasa de carencia material y social severa (ilc_mdsd12) de las personas ocupadas de 18 años o más (situación laboral más frecuente del año anterior): no pueden permitirse al menos 7 de 13 gastos básicos del hogar o personales. Media UE-27: agregado de composición actual (EU27_2020).",
    "Eurostat publica el indicador desde 2015. El indicador anterior de carencia material severa (9 conceptos) no es comparable y no se enlaza.",
    "A diferencia de la tasa de riesgo de pobreza, que cuenta a quienes tienen una renta inferior al 60 % de la mediana del país, no depende de la renta del resto de la población. En España, en 2025, el 6,4 % de las personas ocupadas de 18 años o más estaba en carencia material y social severa y el 11,2 % en riesgo de pobreza (ilc_iw01).",
    "La carencia se mide en todo el hogar: depende del salario de la persona ocupada, pero también de los demás ingresos y del tamaño del hogar.",
    "OCDE, EE. UU. y Canadá: sin dato. El indicador solo existe para los países de la encuesta europea EU-SILC.",
    "España y Media UE-27: primer dato disponible en 2015.",
    "Media OCDE, Estados Unidos y Canadá: sin datos en la ventana 1976-2025."
  ],
  "generado_por": "temas/empleo/notebooks/carencia-material-ocupados.ipynb",
  "generado_en": "2026-10-22T06:45:22Z"
}
