{
  "id": "hogares-30-44-propiedad",
  "tipo": "solo_espana",
  "unidad": "% de los hogares de 30 a 44 años",
  "labels": [
    "1976",
    "1977",
    "1978",
    "1979",
    "1980",
    "1981",
    "1982",
    "1983",
    "1984",
    "1985",
    "1986",
    "1987",
    "1988",
    "1989",
    "1990",
    "1991",
    "1992",
    "1993",
    "1994",
    "1995",
    "1996",
    "1997",
    "1998",
    "1999",
    "2000",
    "2001",
    "2002",
    "2003",
    "2004",
    "2005",
    "2006",
    "2007",
    "2008",
    "2009",
    "2010",
    "2011",
    "2012",
    "2013",
    "2014",
    "2015",
    "2016",
    "2017",
    "2018",
    "2019",
    "2020",
    "2021",
    "2022",
    "2023",
    "2024",
    "2025"
  ],
  "series": {
    "espana": [
      null,
      null,
      null,
      null,
      null,
      null,
      null,
      null,
      null,
      null,
      null,
      null,
      null,
      null,
      null,
      null,
      null,
      null,
      null,
      null,
      null,
      null,
      null,
      null,
      null,
      null,
      null,
      null,
      71.1,
      72.5,
      72.7,
      74.3,
      73.7,
      73.8,
      73.7,
      72.8,
      71.1,
      67.9,
      68.6,
      65.3,
      64.4,
      63.8,
      60.7,
      59.4,
      59.3,
      58.0,
      56.7,
      55.3,
      52.9,
      53.1
    ]
  },
  "fuentes": [
    {
      "serie": "espana",
      "organismo": "INE",
      "dataset_codigo": "ECV2500",
      "url": "https://www.ine.es/consul/serie.do?s=ECV2500",
      "fecha_consulta": "2026-10-10"
    }
  ],
  "notas": [
    "INE, Encuesta de Condiciones de Vida (tabla 9994): porcentaje de hogares cuya persona de referencia tiene entre 30 y 44 años que viven en una vivienda en propiedad, con o sin hipoteca.",
    "Es una encuesta: los datos tienen margen de error muestral.",
    "Solo España: Eurostat no publica el régimen de tenencia según la edad de la persona de referencia del hogar.",
    "España: primer dato disponible en 2004."
  ],
  "generado_por": "temas/vivienda/notebooks/hogares-30-44-propiedad.ipynb",
  "generado_en": "2026-10-10T14:15:56Z"
}
