{
  "id": "tasa-paro-juvenil",
  "tipo": "serie_temporal",
  "unidad": "% de la población activa de 15 a 24 años",
  "labels": [
    "1976",
    "1977",
    "1978",
    "1979",
    "1980",
    "1981",
    "1982",
    "1983",
    "1984",
    "1985",
    "1986",
    "1987",
    "1988",
    "1989",
    "1990",
    "1991",
    "1992",
    "1993",
    "1994",
    "1995",
    "1996",
    "1997",
    "1998",
    "1999",
    "2000",
    "2001",
    "2002",
    "2003",
    "2004",
    "2005",
    "2006",
    "2007",
    "2008",
    "2009",
    "2010",
    "2011",
    "2012",
    "2013",
    "2014",
    "2015",
    "2016",
    "2017",
    "2018",
    "2019",
    "2020",
    "2021",
    "2022",
    "2023",
    "2024",
    "2025"
  ],
  "series": {
    "espana": [
      null,
      null,
      null,
      null,
      null,
      null,
      null,
      null,
      null,
      null,
      null,
      40.45,
      37.89167,
      32.73333,
      30.475,
      29.15833,
      32.35833,
      40.7,
      42.30833,
      39.75834,
      39.225,
      36.15833,
      32.36666,
      26.45833,
      23.225,
      21.08333,
      22.19167,
      22.7,
      21.99167,
      19.65,
      17.90833,
      18.1,
      24.45833,
      37.75,
      41.50834,
      46.20833,
      52.89167,
      55.45833,
      53.20833,
      48.34167,
      44.45833,
      38.65833,
      34.38334,
      32.55833,
      38.29167,
      35.14167,
      29.66667,
      28.69167,
      26.50833,
      24.84167
    ],
    "ue27": [
      null,
      null,
      null,
      null,
      null,
      null,
      null,
      null,
      null,
      null,
      null,
      null,
      null,
      null,
      null,
      null,
      null,
      null,
      null,
      null,
      null,
      null,
      null,
      null,
      null,
      null,
      null,
      null,
      null,
      null,
      null,
      null,
      null,
      21.2,
      22.4,
      22.5,
      24.4,
      25.2,
      24.1,
      22.4,
      20.7,
      18.6,
      16.7,
      15.7,
      17.6,
      16.7,
      14.6,
      14.6,
      15.0,
      15.2
    ],
    "ocde": [
      null,
      null,
      null,
      null,
      null,
      null,
      null,
      null,
      null,
      null,
      null,
      null,
      null,
      null,
      null,
      null,
      null,
      null,
      null,
      null,
      null,
      null,
      null,
      null,
      null,
      null,
      null,
      null,
      null,
      14.1354,
      13.28392,
      12.61749,
      13.48374,
      17.27508,
      17.51146,
      16.8826,
      16.80483,
      16.58058,
      15.50843,
      14.30614,
      13.43819,
      12.47703,
      11.75788,
      11.89292,
      15.3225,
      12.86373,
      10.87958,
      10.60579,
      11.1076,
      null
    ],
    "eeuu": [
      14.73333,
      13.61667,
      12.28333,
      11.8,
      13.81667,
      14.91667,
      17.75833,
      17.19167,
      13.94167,
      13.575,
      13.29167,
      12.20833,
      11.04167,
      10.9,
      11.16667,
      13.425,
      14.21667,
      13.38333,
      12.45833,
      12.05,
      12.01667,
      11.28333,
      10.41667,
      9.908334,
      9.325,
      10.575,
      11.98333,
      12.4,
      11.83333,
      11.30833,
      10.5,
      10.53333,
      12.81667,
      17.56667,
      18.41667,
      17.28333,
      16.18333,
      15.51667,
      13.36667,
      11.6,
      10.41667,
      9.225,
      8.6,
      8.383333,
      15.05833,
      9.725,
      8.091666,
      7.916667,
      8.908334,
      null
    ],
    "canada": [
      12.425,
      13.84167,
      14.075,
      12.76667,
      12.84167,
      12.85,
      18.24167,
      19.30833,
      17.45833,
      15.83333,
      14.70833,
      13.26667,
      11.53333,
      10.96667,
      12.38333,
      15.84167,
      17.2,
      17.16667,
      15.94167,
      14.825,
      15.4,
      16.25833,
      15.175,
      14.05,
      12.69167,
      12.88333,
      13.64167,
      13.61667,
      13.46667,
      12.39167,
      11.61667,
      11.05,
      11.39167,
      15.025,
      14.59167,
      13.95833,
      14.0,
      13.3,
      13.25833,
      12.80833,
      12.60833,
      11.175,
      10.625,
      10.69167,
      20.06667,
      13.60833,
      10.05,
      10.66667,
      13.0,
      13.79167
    ]
  },
  "fuentes": [
    {
      "serie": "espana",
      "organismo": "OECD",
      "dataset_codigo": "DSD_LFS@DF_IALFS_UNE_M",
      "url": "https://data-explorer.oecd.org/",
      "fecha_consulta": "2026-10-18"
    },
    {
      "serie": "ue27",
      "organismo": "Eurostat",
      "dataset_codigo": "une_rt_a",
      "url": "https://ec.europa.eu/eurostat/databrowser/view/une_rt_a/default/table?lang=en",
      "fecha_consulta": "2026-10-18"
    },
    {
      "serie": "ocde",
      "organismo": "OECD",
      "dataset_codigo": "DSD_LFS@DF_IALFS_UNE_M",
      "url": "https://data-explorer.oecd.org/",
      "fecha_consulta": "2026-10-18"
    },
    {
      "serie": "eeuu",
      "organismo": "OECD",
      "dataset_codigo": "DSD_LFS@DF_IALFS_UNE_M",
      "url": "https://data-explorer.oecd.org/",
      "fecha_consulta": "2026-10-18"
    },
    {
      "serie": "canada",
      "organismo": "OECD",
      "dataset_codigo": "DSD_LFS@DF_IALFS_UNE_M",
      "url": "https://data-explorer.oecd.org/",
      "fecha_consulta": "2026-10-18"
    }
  ],
  "notas": [
    "España, EE. UU., Canadá y OCDE: OCDE, Encuestas de población activa (DSD_LFS@DF_IALFS_UNE_M): tasa de paro de 15 a 24 años, media anual, definición armonizada de la OIT. En EE. UU. el tramo es de 16 a 24 años.",
    "UE-27: Eurostat (une_rt_a), de 15 a 24 años, ambos sexos, agregado de composición actual (EU27_2020).",
    "El denominador es la población activa joven (quienes trabajan o buscan empleo), no todos los jóvenes: quienes solo estudian no cuentan. En 2025, los parados de 15 a 24 años eran el 8,4 % de toda la población de esa edad en España y el 6,2 % en la UE-27, con una tasa de paro del 24,9 % y el 15,2 % (Eurostat, une_rt_a, PC_POP y PC_ACT).",
    "Comparación de España en la OCDE y en Eurostat: en los 17 años comunes (2009-2025), la diferencia máxima es de 0,14 puntos, en 2021.",
    "Rupturas de serie de la EPA: cambio de la definición de parado en 2001 y renovación del cuestionario y de la metodología de la encuesta en 2005; la serie de la OCDE las enlaza.",
    "España: primer dato disponible en 1987.",
    "Media UE-27: primer dato disponible en 2009.",
    "Media OCDE: primer dato disponible en 2005.",
    "Estados Unidos y Canadá: primer dato disponible en 1976."
  ],
  "generado_por": "temas/empleo/notebooks/tasa-paro-juvenil.ipynb",
  "generado_en": "2026-10-18T18:47:50Z"
}
