{
  "id": "brecha-empleo-nacidos-extranjero",
  "tipo": "serie_temporal",
  "unidad": "Puntos porcentuales",
  "labels": [
    "1976",
    "1977",
    "1978",
    "1979",
    "1980",
    "1981",
    "1982",
    "1983",
    "1984",
    "1985",
    "1986",
    "1987",
    "1988",
    "1989",
    "1990",
    "1991",
    "1992",
    "1993",
    "1994",
    "1995",
    "1996",
    "1997",
    "1998",
    "1999",
    "2000",
    "2001",
    "2002",
    "2003",
    "2004",
    "2005",
    "2006",
    "2007",
    "2008",
    "2009",
    "2010",
    "2011",
    "2012",
    "2013",
    "2014",
    "2015",
    "2016",
    "2017",
    "2018",
    "2019",
    "2020",
    "2021",
    "2022",
    "2023",
    "2024",
    "2025"
  ],
  "series": {
    "espana": [
      null,
      null,
      null,
      null,
      null,
      null,
      null,
      null,
      null,
      null,
      null,
      null,
      null,
      null,
      null,
      null,
      null,
      null,
      null,
      -0.5,
      -0.8999999999999986,
      0.8999999999999986,
      2.700000000000003,
      3.799999999999997,
      1.8999999999999986,
      5.099999999999994,
      6.0,
      4.899999999999999,
      5.200000000000003,
      6.400000000000006,
      6.300000000000011,
      4.400000000000006,
      2.0,
      -2.299999999999997,
      -2.5,
      -4.5,
      -4.899999999999999,
      -5.399999999999999,
      -5.0,
      -3.8999999999999986,
      -3.4000000000000057,
      -3.0,
      -2.700000000000003,
      -2.799999999999997,
      -6.999999999999993,
      -5.299999999999997,
      -4.599999999999994,
      -3.8000000000000114,
      -4.0,
      -3.700000000000003
    ],
    "ue27": [
      null,
      null,
      null,
      null,
      null,
      null,
      null,
      null,
      null,
      null,
      null,
      null,
      null,
      null,
      null,
      null,
      null,
      null,
      null,
      null,
      null,
      null,
      null,
      null,
      null,
      null,
      -6.700000000000003,
      -7.300000000000004,
      -5.700000000000003,
      -5.0,
      -4.6000000000000085,
      -4.0,
      -4.099999999999994,
      -5.299999999999997,
      -4.900000000000006,
      -5.000000000000007,
      -5.300000000000004,
      -5.900000000000006,
      -5.900000000000006,
      -6.299999999999997,
      -6.700000000000003,
      -7.0,
      -6.400000000000006,
      -6.299999999999997,
      -8.200000000000003,
      -7.5,
      -6.599999999999994,
      -6.3999999999999915,
      -6.5,
      -6.400000000000006
    ],
    "ocde": [
      null,
      null,
      null,
      null,
      null,
      null,
      null,
      null,
      null,
      null,
      null,
      null,
      null,
      null,
      null,
      null,
      null,
      null,
      null,
      null,
      null,
      null,
      null,
      null,
      null,
      null,
      null,
      null,
      null,
      null,
      null,
      null,
      null,
      null,
      null,
      null,
      null,
      null,
      null,
      null,
      null,
      null,
      null,
      null,
      null,
      null,
      null,
      null,
      null,
      null
    ],
    "eeuu": [
      null,
      null,
      null,
      null,
      null,
      null,
      null,
      null,
      null,
      null,
      null,
      null,
      null,
      null,
      null,
      null,
      null,
      null,
      null,
      null,
      null,
      null,
      null,
      null,
      -2.709785459999992,
      -2.3243408200000033,
      -2.448097230000002,
      -1.59746552,
      -0.269378660000001,
      0.2193603500000023,
      1.085136420000012,
      1.532073980000007,
      1.4033050599999939,
      1.6383972200000017,
      2.4530181899999945,
      2.446266179999995,
      2.083816519999999,
      2.6665878299999974,
      2.6246948299999957,
      2.075813300000007,
      2.1389770500000083,
      2.478012089999993,
      2.410797119999998,
      2.4226074200000056,
      0.9925918600000045,
      2.180824279999996,
      3.1981811500000106,
      2.997566219999996,
      2.3708419799999945,
      null
    ],
    "canada": [
      null,
      null,
      null,
      null,
      null,
      null,
      null,
      null,
      null,
      null,
      null,
      null,
      null,
      null,
      null,
      null,
      null,
      null,
      null,
      null,
      null,
      null,
      null,
      null,
      null,
      null,
      null,
      null,
      null,
      null,
      null,
      null,
      -3.4850692699999968,
      -3.668136599999997,
      -3.4573898299999968,
      -3.6683502199999936,
      -2.537612920000001,
      -2.3651809700000115,
      -2.7795257600000127,
      -2.037261959999995,
      -1.1356124899999998,
      -0.8813095099999941,
      -2.0298843300000016,
      -1.5681610100000114,
      -2.114089969999995,
      -0.4669876100000039,
      -0.5898590100000121,
      -0.05014038000000198,
      -0.7204742400000015,
      null
    ]
  },
  "fuentes": [
    {
      "serie": "espana",
      "organismo": "Eurostat",
      "dataset_codigo": "lfsa_ergacob (Y20-64, T, PC): c_birth=FOR menos c_birth=NAT",
      "url": "https://ec.europa.eu/eurostat/databrowser/view/lfsa_ergacob/default/table?lang=en",
      "fecha_consulta": "2026-10-18"
    },
    {
      "serie": "ue27",
      "organismo": "Eurostat",
      "dataset_codigo": "lfsa_ergacob (Y20-64, T, PC): c_birth=FOR menos c_birth=NAT",
      "url": "https://ec.europa.eu/eurostat/databrowser/view/lfsa_ergacob/default/table?lang=en",
      "fecha_consulta": "2026-10-18"
    },
    {
      "serie": "ocde",
      "organismo": "OECD",
      "dataset_codigo": "DSD_MIG@DF_MIG_NUP_SEX: la OCDE no publica el agregado de sus miembros",
      "url": "https://data-explorer.oecd.org/",
      "fecha_consulta": "2026-10-18"
    },
    {
      "serie": "eeuu",
      "organismo": "OECD",
      "dataset_codigo": "DSD_MIG@DF_MIG_NUP_SEX (EMP_WAP, _T): FB menos NB, 15 a 64 años",
      "url": "https://data-explorer.oecd.org/",
      "fecha_consulta": "2026-10-18"
    },
    {
      "serie": "canada",
      "organismo": "OECD",
      "dataset_codigo": "DSD_MIG@DF_MIG_NUP_SEX (EMP_WAP, _T): FB menos NB, 15 a 64 años",
      "url": "https://data-explorer.oecd.org/",
      "fecha_consulta": "2026-10-18"
    }
  ],
  "notas": [
    "España y UE-27: Eurostat (lfsa_ergacob), tasa de empleo de 20 a 64 años de la población nacida en el extranjero menos la de la nacida en el país; UE-27 de composición actual (EU27_2020).",
    "EE. UU. y Canadá: OCDE, resultados laborales de los inmigrantes (DSD_MIG@DF_MIG_NUP_SEX), tasa de empleo de 15 a 64 años de la población nacida en el extranjero menos la de la nacida en el país.",
    "Comparación de la diferencia de España en Eurostat (20 a 64 años) y en la OCDE (15 a 64 años): en los 25 años comunes (2000-2024), la diferencia máxima es de 3,4 puntos, en 2023.",
    "Se usa el país de nacimiento, no la nacionalidad. La diferencia no descuenta las distintas edades, estudios y años de residencia de las dos poblaciones; el notebook muestra las dos tasas por separado.",
    "OCDE: la fuente no publica el agregado de sus miembros y la serie queda vacía.",
    "España: primer dato disponible en 1995.",
    "Media UE-27: primer dato disponible en 2002.",
    "Media OCDE: sin datos en la ventana 1976-2025.",
    "Estados Unidos: primer dato disponible en 2000.",
    "Canadá: primer dato disponible en 2008."
  ],
  "generado_por": "temas/empleo/notebooks/brecha-empleo-nacidos-extranjero.ipynb",
  "generado_en": "2026-10-18T19:11:51Z"
}
