{
  "id": "esfuerzo-compra-hipoteca",
  "tipo": "solo_espana",
  "unidad": "% de la renta disponible del hogar",
  "labels": [
    "1976",
    "1977",
    "1978",
    "1979",
    "1980",
    "1981",
    "1982",
    "1983",
    "1984",
    "1985",
    "1986",
    "1987",
    "1988",
    "1989",
    "1990",
    "1991",
    "1992",
    "1993",
    "1994",
    "1995",
    "1996",
    "1997",
    "1998",
    "1999",
    "2000",
    "2001",
    "2002",
    "2003",
    "2004",
    "2005",
    "2006",
    "2007",
    "2008",
    "2009",
    "2010",
    "2011",
    "2012",
    "2013",
    "2014",
    "2015",
    "2016",
    "2017",
    "2018",
    "2019",
    "2020",
    "2021",
    "2022",
    "2023",
    "2024",
    "2025"
  ],
  "series": {
    "espana": [
      null,
      null,
      null,
      null,
      null,
      null,
      null,
      null,
      null,
      null,
      null,
      47.295,
      56.245,
      65.2175,
      71.4275,
      70.51,
      60.645,
      53.885,
      43.0975,
      42.434999999999995,
      35.96,
      29.3125,
      26.35,
      25.6,
      29.129999999999995,
      31.2625,
      32.25750000000001,
      33.230000000000004,
      36.66,
      40.1975,
      46.46,
      53.16,
      53.622499999999995,
      39.5875,
      37.4075,
      39.2325,
      35.44,
      32.58,
      33.2875,
      31.0325,
      30.54,
      30.342499999999998,
      30.700000000000003,
      30.252499999999998,
      29.705,
      29.0425,
      31.3425,
      36.5075,
      34.55,
      34.307500000000005
    ]
  },
  "fuentes": [
    {
      "serie": "espana",
      "organismo": "Banco de España",
      "dataset_codigo": "D_TKB57210_IPV",
      "url": "https://app.bde.es/bierest/resources/srdatosapp/listaSeries?idioma=es&series=D_TKB57210_IPV&rango=MAX",
      "fecha_consulta": "2026-10-15"
    }
  ],
  "notas": [
    "Banco de España, indicadores de accesibilidad a la vivienda: esfuerzo teórico anual sin deducciones fiscales, en porcentaje de la renta disponible del hogar.",
    "Supone el hogar mediano, que compra una vivienda tipo con un préstamo hipotecario estándar por el 80 % de su valor; las demás hipótesis del préstamo son las de la metodología del Banco de España.",
    "Serie trimestral: se usa la media de los cuatro trimestres de cada año; el año en curso, incompleto, no se incluye.",
    "Solo España: no hay un indicador equivalente en las fuentes internacionales autorizadas.",
    "España: primer dato disponible en 1987."
  ],
  "generado_por": "temas/vivienda/notebooks/esfuerzo-compra-hipoteca.ipynb",
  "generado_en": "2026-10-15T07:30:27Z"
}
