{
  "id": "gasto-politicas-activas",
  "tipo": "serie_temporal",
  "unidad": "% del PIB",
  "labels": [
    "1976",
    "1977",
    "1978",
    "1979",
    "1980",
    "1981",
    "1982",
    "1983",
    "1984",
    "1985",
    "1986",
    "1987",
    "1988",
    "1989",
    "1990",
    "1991",
    "1992",
    "1993",
    "1994",
    "1995",
    "1996",
    "1997",
    "1998",
    "1999",
    "2000",
    "2001",
    "2002",
    "2003",
    "2004",
    "2005",
    "2006",
    "2007",
    "2008",
    "2009",
    "2010",
    "2011",
    "2012",
    "2013",
    "2014",
    "2015",
    "2016",
    "2017",
    "2018",
    "2019",
    "2020",
    "2021",
    "2022",
    "2023",
    "2024"
  ],
  "series": {
    "espana": [
      null,
      null,
      null,
      null,
      null,
      null,
      null,
      null,
      null,
      0.317,
      0.597,
      0.595,
      0.704,
      0.782,
      0.762,
      0.657,
      0.638,
      0.448,
      0.402,
      0.416,
      0.365,
      0.388,
      0.533,
      0.677,
      0.684,
      0.623,
      0.583,
      0.61,
      0.646,
      0.66,
      0.707,
      0.702,
      0.693,
      0.771,
      0.832,
      0.796,
      0.651,
      0.513,
      0.558,
      0.587,
      0.561,
      0.685,
      0.702,
      0.689,
      1.18,
      0.922,
      0.745,
      0.688,
      0.642
    ],
    "ue27": [
      null,
      null,
      null,
      null,
      null,
      null,
      null,
      null,
      null,
      null,
      null,
      null,
      null,
      null,
      null,
      null,
      null,
      null,
      null,
      null,
      null,
      null,
      null,
      null,
      null,
      null,
      null,
      null,
      null,
      null,
      null,
      null,
      null,
      null,
      null,
      null,
      null,
      null,
      null,
      null,
      null,
      null,
      null,
      null,
      null,
      null,
      null,
      null,
      null
    ],
    "ocde": [
      null,
      null,
      null,
      null,
      null,
      null,
      null,
      null,
      null,
      null,
      null,
      null,
      null,
      null,
      null,
      null,
      null,
      null,
      null,
      null,
      null,
      null,
      null,
      null,
      null,
      null,
      null,
      null,
      0.46,
      0.449,
      0.437,
      0.405,
      0.395,
      0.474,
      0.54,
      0.488,
      0.474,
      0.486,
      0.495,
      0.479,
      0.485,
      0.472,
      0.43,
      0.629,
      0.795,
      0.62,
      0.419,
      0.393,
      0.386
    ],
    "eeuu": [
      null,
      null,
      null,
      null,
      null,
      null,
      null,
      null,
      null,
      0.256,
      0.239,
      0.232,
      0.219,
      0.215,
      0.224,
      0.209,
      0.2,
      0.201,
      0.192,
      0.181,
      0.158,
      0.186,
      0.181,
      0.167,
      0.165,
      0.17,
      0.159,
      0.144,
      0.131,
      0.125,
      0.125,
      0.123,
      0.171,
      0.16,
      0.141,
      0.134,
      0.119,
      0.114,
      0.104,
      0.104,
      0.107,
      0.101,
      0.101,
      2.56,
      1.35,
      0.078,
      0.078,
      0.075,
      0.064
    ],
    "canada": [
      null,
      null,
      null,
      null,
      null,
      null,
      null,
      null,
      null,
      0.596,
      0.565,
      0.486,
      0.449,
      0.456,
      0.479,
      0.578,
      0.597,
      0.628,
      0.583,
      0.54,
      0.451,
      0.441,
      0.483,
      0.437,
      0.391,
      0.407,
      0.375,
      0.363,
      0.344,
      0.31,
      0.296,
      0.28,
      0.284,
      0.342,
      0.326,
      0.263,
      0.243,
      0.233,
      0.221,
      0.236,
      0.248,
      0.224,
      0.209,
      0.405,
      3.71,
      0.91,
      0.209,
      0.194,
      0.17
    ]
  },
  "fuentes": [
    {
      "serie": "espana",
      "organismo": "OECD",
      "dataset_codigo": "DSD_LMP@DF_LMP",
      "url": "https://data-explorer.oecd.org/",
      "fecha_consulta": "2026-10-18"
    },
    {
      "serie": "ue27",
      "organismo": "OECD",
      "dataset_codigo": "DSD_LMP@DF_LMP: la OCDE no publica el agregado de la UE-27; Eurostat ya no difunde lmp_expsumm",
      "url": "https://data-explorer.oecd.org/",
      "fecha_consulta": "2026-10-18"
    },
    {
      "serie": "ocde",
      "organismo": "OECD",
      "dataset_codigo": "DSD_LMP@DF_LMP",
      "url": "https://data-explorer.oecd.org/",
      "fecha_consulta": "2026-10-18"
    },
    {
      "serie": "eeuu",
      "organismo": "OECD",
      "dataset_codigo": "DSD_LMP@DF_LMP",
      "url": "https://data-explorer.oecd.org/",
      "fecha_consulta": "2026-10-18"
    },
    {
      "serie": "canada",
      "organismo": "OECD",
      "dataset_codigo": "DSD_LMP@DF_LMP",
      "url": "https://data-explorer.oecd.org/",
      "fecha_consulta": "2026-10-18"
    }
  ],
  "notas": [
    "OCDE, programas del mercado de trabajo (DSD_LMP@DF_LMP): gasto público en las categorías 1 a 7 (servicios públicos de empleo y administración, formación, incentivos al empleo, empleo protegido y con apoyo, creación directa de empleo e incentivos al autoempleo), en % del PIB.",
    "Políticas pasivas (categorías 8 y 9: prestaciones por desempleo y jubilación anticipada), en 2024: 1,64 % del PIB en España y 0,56 % en la OCDE. El gasto en % del PIB sube cuando hay más paro, aunque no cambie el gasto por persona.",
    "Los programas extraordinarios de 2020 y 2021 se recogen en la categoría que cada país les asignó al declararlos a la base de datos; las variaciones de esos años dependen de esa clasificación.",
    "UE-27: la OCDE no publica el agregado en este dataflow y Eurostat ya no difunde la base de datos de políticas del mercado de trabajo; la serie queda vacía.",
    "España, Estados Unidos y Canadá: primer dato disponible en 1985.",
    "Media UE-27: sin datos en la ventana 1976-2024.",
    "Media OCDE: primer dato disponible en 2004."
  ],
  "generado_por": "temas/empleo/notebooks/gasto-politicas-activas.ipynb",
  "generado_en": "2026-10-18T19:06:15Z"
}
