{
  "id": "precio-vivienda-renta",
  "tipo": "solo_espana",
  "unidad": "Años de renta bruta disponible del hogar",
  "labels": [
    "1976",
    "1977",
    "1978",
    "1979",
    "1980",
    "1981",
    "1982",
    "1983",
    "1984",
    "1985",
    "1986",
    "1987",
    "1988",
    "1989",
    "1990",
    "1991",
    "1992",
    "1993",
    "1994",
    "1995",
    "1996",
    "1997",
    "1998",
    "1999",
    "2000",
    "2001",
    "2002",
    "2003",
    "2004",
    "2005",
    "2006",
    "2007",
    "2008",
    "2009",
    "2010",
    "2011",
    "2012",
    "2013",
    "2014",
    "2015",
    "2016",
    "2017",
    "2018",
    "2019",
    "2020",
    "2021",
    "2022",
    "2023",
    "2024",
    "2025"
  ],
  "series": {
    "espana": [
      null,
      null,
      null,
      null,
      null,
      null,
      null,
      null,
      null,
      null,
      null,
      3.0925,
      3.6325000000000003,
      4.0874999999999995,
      4.3149999999999995,
      4.425,
      4.09,
      3.9,
      3.83,
      3.7225,
      3.5475,
      3.5075,
      3.5675000000000003,
      3.8449999999999998,
      4.15,
      4.555,
      5.2425,
      6.14,
      7.1850000000000005,
      8.1325,
      8.835,
      9.3575,
      9.0475,
      8.625,
      8.69,
      8.11,
      7.2725,
      6.705,
      6.73,
      6.6425,
      6.680000000000001,
      6.797499999999999,
      6.9125000000000005,
      6.864999999999999,
      6.9975,
      7.145,
      7.37,
      7.12,
      7.0525,
      7.6
    ]
  },
  "fuentes": [
    {
      "serie": "espana",
      "organismo": "Banco de España",
      "dataset_codigo": "D_TKB57110_IPV",
      "url": "https://app.bde.es/bierest/resources/srdatosapp/listaSeries?idioma=es&series=D_TKB57110_IPV&rango=MAX",
      "fecha_consulta": "2026-10-15"
    }
  ],
  "notas": [
    "Banco de España, indicadores de accesibilidad a la vivienda: precio medio de una vivienda libre de 93,75 m² construidos dividido por la renta bruta estimada del hogar mediano, en años.",
    "Serie trimestral: se usa la media de los cuatro trimestres de cada año; el año en curso, incompleto, no se incluye.",
    "Solo España: la OCDE y Eurostat publican esta ratio como índice, que no permite comparar niveles entre países (ver la gráfica indice-precio-vivienda-renta).",
    "España: primer dato disponible en 1987."
  ],
  "generado_por": "temas/vivienda/notebooks/precio-vivienda-renta.ipynb",
  "generado_en": "2026-10-15T07:30:24Z"
}
