{
  "id": "horas-semanales-tiempo-completo",
  "tipo": "serie_temporal",
  "unidad": "Horas a la semana",
  "labels": [
    "1976",
    "1977",
    "1978",
    "1979",
    "1980",
    "1981",
    "1982",
    "1983",
    "1984",
    "1985",
    "1986",
    "1987",
    "1988",
    "1989",
    "1990",
    "1991",
    "1992",
    "1993",
    "1994",
    "1995",
    "1996",
    "1997",
    "1998",
    "1999",
    "2000",
    "2001",
    "2002",
    "2003",
    "2004",
    "2005",
    "2006",
    "2007",
    "2008",
    "2009",
    "2010",
    "2011",
    "2012",
    "2013",
    "2014",
    "2015",
    "2016",
    "2017",
    "2018",
    "2019",
    "2020",
    "2021",
    "2022",
    "2023",
    "2024",
    "2025"
  ],
  "series": {
    "espana": [
      null,
      null,
      null,
      null,
      null,
      null,
      null,
      null,
      null,
      null,
      null,
      41.0595441370445,
      40.841362959038,
      40.6962004058519,
      40.6566239060942,
      40.5159587443305,
      40.5380727583142,
      40.5187764946215,
      40.5160452008256,
      40.6516998938112,
      40.5542498679089,
      40.6082432736471,
      40.6952645355471,
      40.5831763725948,
      40.5786333706159,
      40.5245423176381,
      40.4468782099188,
      40.3755789161772,
      40.3846834460697,
      40.8556776126201,
      40.7788640806446,
      40.6303738970411,
      40.5159376952951,
      40.327,
      40.212,
      40.106,
      40.077,
      40.127,
      40.026,
      39.887,
      39.764,
      39.615,
      39.561,
      39.382,
      39.174,
      39.366,
      39.418,
      39.326,
      39.239,
      39.211
    ],
    "ue27": [
      null,
      null,
      null,
      null,
      null,
      null,
      null,
      null,
      null,
      null,
      null,
      null,
      null,
      null,
      null,
      null,
      null,
      null,
      null,
      null,
      null,
      null,
      null,
      null,
      null,
      null,
      39.9,
      39.9,
      40.1,
      40.2,
      40.2,
      40.2,
      40.2,
      40.2,
      40.1,
      40.1,
      40.1,
      40.1,
      40.1,
      40.0,
      40.0,
      40.0,
      39.9,
      39.9,
      39.7,
      39.7,
      39.7,
      39.6,
      39.5,
      39.5
    ],
    "ocde": [
      null,
      null,
      null,
      null,
      null,
      null,
      null,
      null,
      null,
      null,
      null,
      null,
      null,
      null,
      null,
      null,
      null,
      null,
      null,
      null,
      null,
      null,
      null,
      null,
      null,
      null,
      null,
      null,
      null,
      null,
      null,
      null,
      null,
      40.708,
      40.823,
      40.85,
      40.89,
      40.868,
      40.875,
      40.85,
      40.798,
      40.732,
      40.67,
      40.593,
      40.324,
      40.75,
      40.717,
      40.294,
      40.156,
      40.039
    ],
    "eeuu": [
      null,
      null,
      null,
      41.1753253885441,
      40.9829862734849,
      40.8987885627268,
      40.8246327935561,
      40.867918263444,
      41.0347338125714,
      41.1235936360029,
      41.1256033210793,
      41.2505126202216,
      41.2819894462882,
      41.3612787759685,
      41.3180515429505,
      41.2250606135141,
      41.282181894131,
      41.3441880204629,
      41.8865820955966,
      41.9563079330039,
      41.964136864041,
      41.9513685720139,
      41.980683505196,
      41.9661690514825,
      41.9603798216191,
      41.8028115015974,
      41.7249341612041,
      41.6257050641665,
      41.6668008871881,
      41.6639722713315,
      41.7506588726665,
      41.6923211657743,
      41.5872168961816,
      41.359,
      41.404,
      41.439,
      41.513,
      41.494,
      41.598,
      41.549,
      41.544,
      41.52,
      41.547,
      41.548,
      41.369,
      41.38,
      41.37,
      41.25,
      41.168,
      40.959
    ],
    "canada": [
      null,
      null,
      null,
      null,
      null,
      null,
      null,
      null,
      null,
      null,
      null,
      null,
      null,
      null,
      null,
      null,
      null,
      null,
      null,
      null,
      null,
      null,
      null,
      null,
      null,
      null,
      null,
      null,
      null,
      null,
      null,
      null,
      null,
      null,
      null,
      null,
      null,
      null,
      null,
      null,
      null,
      null,
      null,
      null,
      null,
      null,
      null,
      null,
      null,
      null
    ]
  },
  "fuentes": [
    {
      "serie": "espana",
      "organismo": "OECD",
      "dataset_codigo": "DSD_HW@DF_AVG_USL_WK_WKD",
      "url": "https://data-explorer.oecd.org/",
      "fecha_consulta": "2026-10-18"
    },
    {
      "serie": "ue27",
      "organismo": "Eurostat",
      "dataset_codigo": "lfsa_ewhuis",
      "url": "https://ec.europa.eu/eurostat/databrowser/view/lfsa_ewhuis/default/table?lang=en",
      "fecha_consulta": "2026-10-18"
    },
    {
      "serie": "ocde",
      "organismo": "OECD",
      "dataset_codigo": "DSD_HW@DF_AVG_USL_WK_WKD",
      "url": "https://data-explorer.oecd.org/",
      "fecha_consulta": "2026-10-18"
    },
    {
      "serie": "eeuu",
      "organismo": "OECD",
      "dataset_codigo": "DSD_HW@DF_AVG_USL_WK_WKD",
      "url": "https://data-explorer.oecd.org/",
      "fecha_consulta": "2026-10-18"
    },
    {
      "serie": "canada",
      "organismo": "OECD",
      "dataset_codigo": "DSD_HW@DF_AVG_USL_WK_WKD: publica 0 horas en todos los años (sin dato)",
      "url": "https://data-explorer.oecd.org/",
      "fecha_consulta": "2026-10-18"
    }
  ],
  "notas": [
    "España, EE. UU., Canadá y OCDE: OCDE, horas trabajadas (DSD_HW@DF_AVG_USL_WK_WKD): media de horas habituales a la semana en el empleo principal de los asalariados a tiempo completo de 15 a 64 años.",
    "UE-27: Eurostat (lfsa_ewhuis), media de horas habituales en el empleo principal de los asalariados a tiempo completo de 15 a 64 años, agregado de composición actual (EU27_2020).",
    "Comparación de España en la OCDE y en Eurostat: en los 39 años comunes (1987-2025), la diferencia máxima es de 0,2 puntos, en 2019.",
    "Son horas habituales, no efectivas: no descuentan vacaciones, festivos ni bajas. La jornada máxima legal en España es de cuarenta horas semanales de promedio en cómputo anual (Estatuto de los Trabajadores, artículo 34).",
    "La frontera entre tiempo completo y tiempo parcial la declara la persona encuestada y varía entre países.",
    "Canadá: la OCDE publica este indicador con valor 0 en todos los años, que no es un dato; la serie queda vacía.",
    "España: primer dato disponible en 1987.",
    "Media UE-27: primer dato disponible en 2002.",
    "Media OCDE: primer dato disponible en 2009.",
    "Estados Unidos: primer dato disponible en 1979.",
    "Canadá: sin datos en la ventana 1976-2025."
  ],
  "generado_por": "temas/empleo/notebooks/horas-semanales-tiempo-completo.ipynb",
  "generado_en": "2026-10-18T18:48:07Z"
}
